plot_id,forest_type,english_holly,english_ivy,trailing_blackberry,spiny_wood_fern,salal,wall_lettuce,sword_fern,deer_fern,huckleberry,species2,sugar_scoop,salmon_berry,alderberry,herb_robert,large_leaved_avens,creeping_buttercup,oregon_grape,common_snowberry,tall_fescue,cherry_laurel,mosses,canopy_cover,pH1,pH2,pH3,site_characteristics,species_richness,mean_percent_cover,percent_cover_sd,shannon_wiener_index,pH_mean,site_type
Holly 1,Coniferus,12,0,8,28,4,1,0,6,2,3,0,0,0,0,0,0,0,0,0,0,9,95,5,5.5,5,"Damp environment, quarter of plot slightly elevated (no Holly contained there).",8,8,8.831760866327848,1.6474142723788514,5.166666666666667,invaded
Holly 1 Control,Coniferus,0,0,35,7,10,3,0,15,2,35,0,0,0,0,0,0,0,0,0,0,15,90,6,5.5,6.5,"Damp environment, relatively flat – slightly elevated in middle.",7,15.285714285714286,14.15055105775373,1.581011352954953,6,control
Holly 2,Coniferus,6,0,25,10,5,8,0,0,8,25,4,0,0,0,0,0,0,0,0,0,90,10,4.5,5,5.5,"Damp environment, flat.",8,11.375,8.617880084037903,1.8560943344042538,5,invaded
Holly 2 Control,Coniferus,0,0,20,30,0,0,1,0,3,0,3,0,0,0,0,0,0,0,0,0,60,25,5.5,6,6.5,"Damp environment, flat.",5,11.4,12.934450123604018,1.08616985287046,6,control
Holly 3,Deciduous,10,0,10,0,0,0,40,0,0,0,0,50,0,3,0,0,10,0,0,3,20,10,6,5.5,5.5,"Gradual slope, low side South. Creek directly next to site. Raining day of data collection.",7,18,18.929694486000912,1.5122695660165988,5.666666666666667,invaded
Holly 3 Control,Deciduous,0,0,30,0,0,0,5,0,0,0,0,60,0,5,0,0,0,0,0,0,60,5,6.5,6.5,7,Flat. Standing water directly next to site. Raining day of data collection.,4,25,26.14064523559687,0.9672604429127744,6.666666666666667,control
Holly 4,Deciduous,3,0,0,15,0,0,2,0,1,0,0,3,0,0,0,0,0,0,0,0,50,NA,6.5,6,6,High precipitation during data collection. Moist environment. Some standing water in site.,5,4.8,5.761944116355173,1.1531071174453749,6.166666666666667,invaded
Holly 4 Control,Deciduous,0,0,2,0,0,0,12,0,0,0,5,30,0,0,0,0,0,0,0,0,10,NA,6,6,6,High precipitation during data collection. Moist environment.,4,12.25,12.553220038433698,1.0083859068736662,6,control
